Title,Description,Remediation,PowerShell Script,Returned Value,Default Value,Expected Value,Impact,Likelihood,Priority,RiskRating,References
CIS MEx 3.2.2 - Teams DLP Policies Not Enabled and Enforced,Enabling the default Teams DLP policy rule in Microsoft 365 helps protect an organization's sensitive information by preventing accidental sharing or leakage of that information in Teams conversations and channels.,Use the PowerShell script to create a new DLPCompliancePolicy or review the policies existence and if they are enabled.,"New-DlpCompliancePolicy -Name ""SSN Teams Policy"" -Comment ""SSN Teams Policy"" -TeamsLocation All -Mode Enable",Default Value:Enable,Enable,Enable,2,1,Informational,Low,Learn about data loss prevention
CIS MEx 3.3.1 - No SharePoint Online Data Classification Policies Set!,"By categorizing and applying policy-based protection, SharePoint Online Data Classification Policies can help reduce the risk of data loss or exposure, and enable more effective incident response if a breach does occur.",Use the PowerShell script to create a New Label Policy,"New-LabelPolicy -Name ""Example Name"" -Labels ""Example"",""Domain""",No Label Policy Active,No Policy,A Policy,2,4,Medium,Medium,Top sensitivity labels applied to content
CIS MEx 3.2.1 - DLP Policy is not enabled!,"Enabling DLP policies alerts users and administrators that specific types of data should not be exposed, helping to protect the data from accidental exposure.",Use the PowerShell script to configure a New-Dlp Compliance Policy,"New-DlpPolicy -Name ""Contoso PII"""" -Template {templatehere}",No DLP Policy Active,No Policy,A Policy,2,3,Informational,Medium,Learn about data loss prevention
CIS MEx 2.1.4 - Safe Attachments Not Enabled,"Enabling Safe Attachments policy helps protect against malware threats in email attachments by analyzing suspicious attachments in a secure, cloud-based environment before they are delivered to the user's inbox. This provides an additional layer of security and can prevent new or unseen types of malware from infiltrating the organization's network.",Run the following PowerShell command:,"$domains = Get-AcceptedDomain; New-SafeAttachmentPolicy -Name ""Safe Attachment Policy"" -Enable $true -Redirect $false -RedirectAddress $ITSupportEmail New-SafeAttachmentRule -Name ""Safe Attachment Rule"" -SafeAttachmentPolicy ""Safe Attachment Policy"" -RecipientDomainIs $domains[0]",No SafeAttachmentPolicy Found!,False,True,3,5,High,High,Deploy ATP with PowerShell
CIS MEx 2.1.7 - Anti-Phishing policy not has been created,"Protects users from phishing attacks (like impersonation and spoofing), and uses safety tips to warn users about potentially harmful messages.",Rune the following command to create a new AntiPhishPolicy,"$domains = Get-AcceptedDomain; New-AntiPhishPolicy -Name ""AntiPhish Policy"" -Enabled $true -EnableOrganizationDomainsProtection $true -EnableSimilarUsersSafetyTips $true -EnableSimilarDomainsSafetyTips $true -EnableUnusualCharactersSafetyTips $true -AuthenticationFailAction Quarantine -EnableMailboxIntelligenceProtection $true -MailboxIntelligenceProtectionAction movetoJMF -PhishThresholdLevel 2 -TargetedUserProtectionAction movetoJMF -EnableTargetedDomainsProtection $true -TargetedDomainProtectionAction MovetoJMF -EnableAntispoofEnforcement $true New-AntiPhishRule -Name ""AntiPhish Rule"" -AntiPhishPolicy ""AntiPhish Policy"" -RecipientDomainIs $domains[0]",No AntiPhish Policy Available,No Policy,A Policy,3,5,High,High,Securing Your Office 365 Tenants. Part 2
CIS MEx 2.4.2 - Priority accounts do not have 'Strict protection' presets applied,"Enabling priority account protection for users in Microsoft 365 is necessary to enhance security for accounts with access to sensitive data and high privileges, such as CEOs, CISOs, CFOs, and IT admins. These priority accounts are often targeted by spear phishing or whaling attacks and require stronger protection to prevent account compromise. To address this, Microsoft 365 and Microsoft Defender for Office 365 offer several key features that provide extra security, including the identification of incidents and alerts involving priority accounts and the use of built-in custom protections designed specifically for them.",Use the PowerShell Script to enable PriorityAccountProtection,"Enable-EOPProtectionPolicyRule -Identity ""Strict Preset Security Policy""; Enable-ATPProtectionPolicyRule -Identity ""Strict Preset Security Policy""",No Strict AntiPhishPolicy Available No Strict MalwareFilterPolicy Available No Strict HostedContentFilterPolicy Available No Strict SafeAttachmentPolicy Available No Strict SafeLinksPolicy Available No Strict EOPProtectionPolicy Available No Strict ATPProtectionPolicy Available,True,True,3,5,Medium,High,Preset security policies in EOP and Microsoft Defender for Office 365
CIS MEx 2.1.1 - Safe Links for Office Applications is not Enabled!,"Enabling Safe Links policy for Office applications allows URL's that exist inside of Office documents and email applications opened by Office, Office Online and Office mobile to be processed against Defender for Office time-of-click verification and rewritten if required. Safe Links for Office applications extends phishing protection to documents and emails that contain hyperlinks, even after they have been delivered to a user.",Use the PowerShell Script to create and apply the policy within your organization.,"$params = @{ Name = ""CIS SafeLinks Policy"" EnableSafeLinksForEmail = $true EnableSafeLinksForTeams = $true EnableSafeLinksForOffice = $true TrackClicks = $true AllowClickThrough = $false ScanUrls = $true EnableForInternalSenders = $true DeliverMessageAfterScan = $true DisableUrlRewrite = $false }; New-SafeLinksPolicy @params ; New-SafeLinksRule -Name ""CIS SafeLinks"" -SafeLinksPolicy ""CIS SafeLinks Policy"" -RecipientDomainIs (Get-AcceptedDomain).Name -Priority 0",Subscription is not Active. Thus SafeLinks is not working,Undefined,EnableSafeLinksForEmail: True EnableSafeLinksForTeams: True EnableSafeLinksForOffice: True TrackClicks: True AllowClickThrough: False ScanUrls: True EnableForInternalSenders: True DeliverMessageAfterScan: True DisableUrlRewrite: False,3,4,High,High,SafeLinks Policy Configuration
CIS MEx 2.1.5 - Safe Attachments for Office Applications is not Enabled!,"Safe Attachments for SharePoint, OneDrive, and Microsoft Teams protects organizations from inadvertently sharing malicious files. When a malicious file is detected, that file is blocked so that no one can open, copy, move, or share it until further actions are taken by the organization's security team.",Use the PowerShell Script to create and apply the policy within your organization.,Set-AtpPolicyForO365 -EnableATPForSPOTeamsODB $true -EnableSafeDocs $true -AllowSafeDocsOpen $false,ATP Policy is not working!,Undefined,EnableATPForSPOTeamsODB: True EnableSafeDocs: True AllowSafeDocsOpen: False,2,5,High,High,Deploy ATP with PowerShell
CIS MAz 2.4.3 - Unable to verify if Microsoft Defender for Cloud Apps is enabled and configured,"Security teams can receive notifications of triggered alerts for atypical or suspicious activities, see how the organization's data in Microsoft 365 is accessed and used, suspend user accounts exhibiting suspicious activity, and require users to log back in to Microsoft 365 apps after an alert has been triggered","The implementation of Microsoft Defender for Cloud App MUST be done manually, because there is no automatic script available at this moment.",https://learn.microsoft.com/en-us/defender-cloud-apps/get-started,,No Microsoft Defender for Cloud Apps active,Microsoft Defender for Cloud Apps active,0,0,Informational,Informational,Microsoft Defender for Cloud Apps - Get Started
CISMAz 5.1.1.1 - The Security Defaults are enabled on Azure Active Directory Tenant,Security defaults in Azure Active Directory (Azure AD) make it easier to be secure and help protect your organization. Security defaults contain preconfigured security settings for common attacks.,Use the PowerShell Script to disable Security Defaults on Microsoft Azure Active Directory,"$body = $body = (@{""isEnabled""=""false""} | ConvertTo-Json) ;Invoke-MgGraphRequest -Method PATCH https://graph.microsoft.com/beta/policies/identitySecurityDefaultsEnforcementPolicy -Body $body",True,"True for tenants created later than 2019, False for tenants created before 2019",False,4,1,Medium,Low,Security defaults in Microsoft Entra ID
CIS Az 1.5 - Number of methods required to reset a password is not set to 2 or more methods,"A Self-service Password Reset (SSPR) through Azure Multi-factor Authentication (MFA) ensures the user's identity is confirmed using two separate methods of identification. With multiple methods set, an attacker would have to compromise both methods before they could maliciously reset a user's password.",Manually change the value from 1 to 2 in the Azure Portal. There is no script available at this moment unfortunately.,https://portal.azure.com/#view/Microsoft_AAD_IAM/PasswordResetMenuBlade/~/AuthenticationMethods,1,2,2,3,1,High,Low,Tutorial: Enable users to unlock their account or reset passwords using Microsoft Entra self-service password reset
CIS Az 2.1.19 - Notify about alerts with the following severity is not Set to High,Enabling security alert emails ensures that security alert emails are received from Microsoft. This ensures that the right people are aware of any potential security issues and are able to mitigate the risk.,You can change the settings in the URL written in PowerShellScript.,https://portal.azure.com/#view/Microsoft_Azure_SubscriptionManagement/ManageSubscriptionPoliciesBlade,,High,High,3,1,Medium,Low,Quickstart: Configure email notifications for security alerts
CIS Az 5.1.1 - 'Diagnostic Setting' does not exist for some Subscription Activity Logs,"A diagnostic setting controls how a diagnostic log is exported. By default, logs are retained only for 90 days. Diagnostic settings should be defined so that logs can be exported and stored for a longer duration in order to analyze security activities within an Azure subscription.",Use the PowerShell Script to remediate the issue.,New-AzDiagnosticSetting,,Disabled,Enabled,2,1,Low,Low,Overview of Azure platform logs
CIS Az 2.2.1 - Ensure That Microsoft Defender for IoT Hub Is Set To 'On',IoT devices are very rarely patched and can be potential attack vectors for enterprise networks. Updating their network configuration to use a central security hub allows for detection of these breaches,You can change the settings in the URL written in PowerShellScript.,https://portal.azure.com/#view/Microsoft_Azure_SubscriptionManagement/ManageSubscriptionPoliciesBlade,Unable to audit...,Off,On,2,1,Low,Low,Defender EASM Overview
CIS MAz 5.2.4.1 - Self Service Password Reset is not set to be enabled for all users,"Users will no longer need to engage the helpdesk for password resets, and the password reset mechanism will automatically block common, easily guessable passwords.",Manually change the value from 0 (None) or 1 (Selected) to 2 (All) in the Azure Portal. There is no script available at this moment unfortunately.,https://entra.microsoft.com/#view/Microsoft_AAD_IAM/PasswordResetMenuBlade/~/Properties,0,0,2,3,3,High,Medium,Let users reset their own passwords
CISMAz 5.1.5.2 - User consent to apps accessing company data on their behalf is allowed!,"Attackers commonly use custom applications to trick users into granting them access to company data. Disabling future user consent operations setting mitigates this risk, and helps to reduce the threat-surface. If user consent is disabled previous consent grants will still be honored but all future consent operations must be performed by an administrator.",Use the PowerShell Script disable user consent for Non-Admin Users.,$params = @{ defaultUserRolePermissions = @{ permissionGrantPoliciesAssigned = @() } }; Update-MgPolicyAuthorizationPolicy -BodyParameter $params,ManagePermissionGrantsForSelf.microsoft-user-default-legacy ManagePermissionGrantsForOwnedResource.microsoft-dynamically-managed-permissions-for-team ManagePermissionGrantsForOwnedResource.microsoft-dynamically-managed-permissions-for-chat,Null,Null,3,2,Medium,Medium,Configure how users consent to applications
CIS Az 1.6 - No Custom Bad Password List is set to 'Enforce' for your Organization,"Enabling this gives your organization further customization on what secure passwords are allowed. Setting a bad password list enables your organization to fine-tune its password policy further, depending on your needs. Removing easy-to-guess passwords increases the security of access to your Azure resources",Manually enable Enforce custom list and set it to True. There is no script available at this moment unfortunately.,https://portal.azure.com/#view/Microsoft_AAD_IAM/AuthenticationMethodsMenuBlade/~/PasswordProtection,CustomBannedPasswords: False PolicyMode: 0,False + No List,True + List with passwords,1,5,Medium,Medium,Combined password policy and check for weak passwords in Microsoft Entra ID
CISM MAz 5.2.3.2 - No Custom Bad Password List is used within your organization,"Creating a new password can be difficult regardless of one's technical background. It is common to look around one's environment for suggestions when building a password, however, this may include picking words specific to the organization as inspiration for a password. An adversary may employ what is called a 'mangler' to create permutations of these specific words in an attempt to crack passwords or hashes making it easier to reach their goal.",Manually enable Enforce custom list and set it to True. There is no script available at this moment unfortunately.,https://portal.azure.com/#view/Microsoft_AAD_IAM/AuthenticationMethodsMenuBlade/~/PasswordProtection,CustomBannedPasswords: False PolicyMode: 0,False + No List,True + List with passwords,1,5,Medium,Medium,Tutorial: Configure custom banned passwords for Microsoft Entra password protection
CIS Az 2.1.18 - Additional email addresses is not Configured with any Security Contact Email,Microsoft Defender for Cloud emails the Subscription Owner to notify them about security alerts. Adding your Security Contact's email address to the 'Additional email addresses' field ensures that your organization's Security Team is included in these alerts. This ensures that the proper people are aware of any potential compromise in order to mitigate the risk in a timely fashion.,You can change the settings in the URL written in PowerShellScript or enable an Azure Policy for your organization.,https://portal.azure.com/#view/Microsoft_Azure_SubscriptionManagement/ManageSubscriptionPoliciesBlade,No Emailaddresses specified,"By default, there are no additional email addresses entered.",An email address,1,5,Medium,Medium,Quickstart: Configure email notifications for security alerts
CIS MAz 5.1.2.6 - LinkedIn Account Connections is enabled!,Disabling LinkedIn integration prevents potential phishing attacks and risk scenarios where an external party could accidentally disclose sensitive information.,Change the value to 1 (No) to disable LinkedIn,https://entra.microsoft.com/#view/Microsoft_AAD_UsersAndTenants/UserManagementMenuBlade/~/UserSettings/menuId/UserSettings,enableLinkedInAppFamily: 0,0,1,1,5,Medium,Medium,Integrate LinkedIn account connections in Microsoft Entra ID
CIS MAz 5.3.1 - Verify if Priviledged Identity Management (PIM) is used to manage roles,"Organizations want to minimize the number of people who have access to secure information or resources, because that reduces the chance of a malicious actor getting that access, or an authorized user inadvertently impacting a sensitive resource. However, users still need to carry out privileged operations in Azure AD and Office 365. Organizations can give users just-in-time (JIT) privileged access to roles. There is a need for oversight for what those users are doing with their administrator privileges. PIM helps to mitigate the risk of excessive, unnecessary, or misused access rights.",Unfortunately we cannot accurately detect if a Privileged Identity Management is active. In order to check this you must have AAD P2 License assigned to your subscription.,https://entra.microsoft.com/#view/Microsoft_Azure_PIMCommon/ResourceMenuBlade/~/quickstart/resourceId//resourceType/tenant/provider/aadroles,"Please manually check if Priviledged Identity Management is enabled. Privileged Identity Management can't be used, because no P2 License is assigned!",No Policy,A Correctly Configured Policy,1,5,Medium,Medium,Create an access review of groups and applications in Mirosoft Entra ID
CIS Az 1.17 - Restrict user ability to access groups features in the Access Pane is Set to 'No',"Self-service group management enables users to create and manage security groups or Office 365 groups in Microsoft Entra ID. Unless a business requires this day-to-day delegation for some users, self-service group management should be disabled.",Change the Value to False to restrict non-admin users from accessing sensitive data. There is no automatic script available at this moment unfortunately.,https://portal.azure.com/#view/Microsoft_AAD_IAM/GroupsManagementMenuBlade/~/General,Restrict user ability to access groups features in the Access Panel is Set to : True,True,False,1,5,Medium,Medium,Set up self-service group management in Microsoft Entra ID
CIS Az 1.1.4 - Allow users to remember multi-factor authentication on devices they trust is Enabled,"Remembering Multi-Factor Authentication (MFA) for devices and browsers allows users to have the option to bypass MFA for a set number of days after performing a successful sign-in using MFA. This can enhance usability by minimizing the number of times a user may need to perform two-step verification on the same device. However, if an account or device is compromised, remembering MFA for trusted devices may affect security. Hence, it is recommended that users not be allowed to bypass MFA.",Check via the link,https://account.activedirectory.windowsazure.com/UserManagement/MfaSettings.aspx,Check the value here: https://account.activedirectory.windowsazure.com/UserManagement/MfaSettings.aspx,Disabled,Disabled,4,1,Medium,Medium,Configure Microsoft Entra multifactor authentication settings
CIS Az 1.10 - User consent for applications is not set to: 'Do not allow user consent',"If Microsoft Entra ID is running as an identity provider for third-party applications, permissions and consent should be limited to administrators or pre-approved. Malicious applications may attempt to exfiltrate data or abuse privileged user accounts",Goto: https://portal.azure.com/#view/Microsoft_AAD_IAM/ConsentPoliciesMenuBlade/~/UserSettings or Use the PowerShell Command,Import-Module Microsoft.Graph.Identity.SignIns; $params = @{DefaultUserRolePermissions = @{PermissionGrantPoliciesAssigned = @()}}; Update-MgPolicyAuthorizationPolicy -BodyParameter $params,ManagePermissionGrantsForSelf.microsoft-user-default-legacy ManagePermissionGrantsForOwnedResource.microsoft-dynamically-managed-permissions-for-team ManagePermissionGrantsForOwnedResource.microsoft-dynamically-managed-permissions-for-chat,Allow user consent for apps,"Do not allow user consent or Allow user consent for apps from verified publishers, for selected permissions",3,4,High,Medium,Admin Consent for Permissions in Azure Active Directory
CIS MAz 5.2.2.5 - Phishing-resistant MFA strength must be required for Administrators,Sophisticated attacks targeting MFA are more prevalent as the use of it becomes more widespread. These 3 methods are considered phishing-resistant as they remove passwords from the login workflow. It also ensures that public/private key exchange can only happen between the devices and a registered provider which prevents login to fake or phishing websites..,Configure the policy at the ConditionalAccess Blade below in the PowerShell Script. There is a Policy Template available which you can create if there is no such policy created beforehand.,https://entra.microsoft.com/#view/Microsoft_AAD_ConditionalAccess/ConditionalAccessBlade/~/Policies,No Policy Configured!,No Policy,,2,5,Medium,High,Passwordless authentication options for Microsoft Entra ID
CIS Az 1.14 - Guest users access restrictions is not set to 'Guest user access is restricted to properties and memberships of their own directory objects',"Limiting guest access ensures that guest accounts do not have permission for certain directory tasks, such as enumerating users, groups or other directory resources, and cannot be assigned to administrative roles in your directory. Guest access has three levels of restriction. 1. Guest users have the same access as members (most inclusive)  2. Guest users have limited access to properties and memberships of directory objects 3. Guest user access is restricted to properties and memberships of their own directory objects The recommended option is the 3rd, most restrictive: 'Guest user access is restricted to their own directory object'",Use the PowerShell Script to mitigate this issue:,"Update-MgPolicyAuthorizationPolicy -GuestUserRoleId ""2af84b1e-32c8-42b7-82bc-daa82404023b""",10dae51f-b6af-4016-8d66-8c2a99b929b3,10dae51f-b6af-4016-8d66-8c2a99b929b3,2af84b1e-32c8-42b7-82bc-daa82404023b,3,5,High,High,Member and guest users
CIS MAz 5.2.3.4 - Not all member users are 'MFA capable',"Multifactor authentication requires an individual to present a minimum of two separate forms of authentication before access is granted. Users who are not MFA Capable have never registered a strong authentication method for multifactor authentication that is within policy and may not be using MFA. This could be a result of having never signed in, exclusion from a Conditional Access (CA) policy requiring MFA, or a CA policy does not exist. Reviewing this list of users will help identify possible lapses in policy or procedure",Implement a CA policy to require all users to use MFA and include all users,https://entra.microsoft.com/#view/Microsoft_AAD_IAM/AuthenticationMethodsMenuBlade/~/UserRegistrationDetails/fromNav/Identity,file://C:\Out\CISMAz5234-NotCapableMFAUsers.txt,IsMFACapable: false if there is no CA policy enforcing MFA,IsMFACapable: true,3,5,High,High,View applied Conditional Access policies in Microsoft Entra sign-in logs
CIS MAz 5.2.2.2 - MultiFactor Authentication (MFA) is not enabled for all users non-administrative roles,"Multifactor authentication requires an individual to present a minimum of two separate forms of authentication before access is granted. Multifactor authentication provides additional assurance that the individual attempting to gain access is who they claim to be. With multifactor authentication, an attacker would need to compromise at least two different authentication mechanisms, increasing the difficulty of compromise and thus reducing the risk.",It is recommended to enable MFA via Conditional Access if the license is applicable. There is no new script available. You can use the old MSOL Script if you want to enable per-user MFA,https://admindroid.sharepoint.com/:u:/s/external/EVzUDxQqxWdLj91v3mhAipsBt0GqNmUK5b4jFXPr181Svw?e=OOcfQn&isSPOFile=1,Number of User Accounts without MFA: 11,"True for tenants >2019, False for tenants <2019",Number of User Accounts without MFA: 0,3,5,High,High,Common Conditional Access policy: Require MFA for administrators
CIS Az 1.13 - Users Can Register Applications Is Set to 'Yes',It is recommended to only allow an administrator to register custom-developed applications. This ensures that the application undergoes a formal security review and approval process prior to exposing Microsoft Entra ID data. Certain users like developers or other high-request users may also be delegated permissions to prevent them from waiting on an administrative user. Your organization should review your policies and decide your needs.,Use the PowerShell Script to enable Security Defaults on Microsoft Entra ID,Import-Module Microsoft.Graph.Identity.SignIns; $params = @{AllowedToCreateApps = $false}; Update-MgPolicyAuthorizationPolicy -BodyParameter $params,True,True,False,3,5,Medium,High,Restrict who can create applications
CIS MAz 5.2.3.1 - Microsoft Authenticator is not configured to protect against MFA fatigue,"As the use of strong authentication has become more widespread, attackers have started to exploit the tendency of users to experience 'MFA fatigue.' This occurs when users are repeatedly asked to provide additional forms of identification, leading them to eventually approve requests without fully verifying the source. To counteract this, number matching can be employed to ensure the security of the authentication process. With this method, users are prompted to confirm a number displayed on their original device and enter it into the device being used for MFA. Additionally, other information such as geolocation and application details are displayed to enhance the end user's awareness. Among these 3 options, number matching provides the strongest net security gain.",Navigate to Microsoft Entra and select Microsoft Authenticator. Review the settings and set it to all_users and enable the first 3 options in the Configure section.,https://entra.microsoft.com/#view/Microsoft_AAD_IAM/AuthenticationMethodsMenuBlade/~/AdminAuthMethods,displayAppInformationRequiredState: default targetid: all_users,"Enabled for tenants >2022, Disabled for tenants <2022",From 2023 if not manually assigned it would be enabled if Microsoft manages the setting.,3,5,High,High,Protecting authentication methods in Microsoft Entra ID
