Description,RiskRating
Organizations wishing to create tighter security controls for external sharing can set this to enforce role-based access control by using security groups already defined in Microsoft Entra.,Informational
This setting ensures that guests who no longer need access to the site or link no longer have access after a set period of time. Allowing guest access for an indefinite amount of time could lead to loss of data confidentiality and oversight.,High
"Strong authentication controls, such as the use of multifactor authentication, may be circumvented if basic authentication is used by SharePoint applications. Requiring modern authentication for SharePoint applications ensures strong authentication mechanisms are used when establishing sessions between these applications, SharePoint, and connecting users.",High
By increasing the frequency of times guests need to reauthenticate this ensures guest user access to data is not prolonged beyond an acceptable amount of time.,High
"External users assigned guest accounts will be subject to Azure AD access policies, such as multi-factor authentication. This provides a way to manage guest identities and control access to SharePoint and OneDrive resources. Without this integration, files can be shared without account registration, making it more challenging to audit and manage who has access to the organization's data.",High
It is recommended to review your Guest Users to determine if they still need access within your tenant or that you can safely remove them.,Informational
"Ensure that only organizationally managed and approved public groups exist. When a group has a 'public' privacy, users may access data related to this group.",Informational
Disable external sharing of Sway documents that can contain sensitive information to prevent accidental or arbitrary data leak.,Low
"Organizations such as NIST and Microsoft have updated their password policy recommendations to not arbitrarily require users to change their passwords after a specific amount of time, unless there is evidence that the password is compromised or the user forgot it. They suggest this even for single factor (Password Only) use cases, with a reasoning that forcing arbitrary password changes on users actually make the passwords less secure. Other recommendations within this Benchmark suggest the use of MFA authentication for at least critical accounts (at minimum), which makes password expiration even less useful as well as password protection for Azure AD..",Low
"Ending idle sessions through an automatic process can help protect sensitive company data, and will add another layer of security for end users who work on unmanaged devices that can potentially be accessed by the public. Unauthorized individuals onsite or remotely can take advantage of systems left unattended over time. Automatic timing out of sessions makes this more difficult.",Medium
"By using external storage services an organization may increases the risk of data breaches and unauthorized access to confidential information. Additionally, third-party services may not adhere to the same security standards as the organization, making it difficult to maintain data privacy and security.",High
"Attackers commonly use vulnerable and custom-built add-ins to access data in user applications. While allowing users to install add-ins by themselves does allow them to easily acquire useful add-ins that integrate with Microsoft applications, it can represent a risk if not used and monitored carefully. Disable future user's ability to install add-ins in Microsoft Word, Excel, or PowerPoint helps reduce your threat-surface and mitigate this risk.",High
"Ensuring administrative accounts are cloud-only, without applications assigned to them will reduce the attack surface of high privileged identities in your environment. In order to participate in Microsoft 365 security services such as Identity Protection, PIM and Conditional Access an administrative account will need a license attached to it. Ensure that the license used does not include any applications with potentially vulnerable services by using either Microsoft Entra ID P1 or Microsoft Entra ID P2 for the cloud-only account with administrator roles.",High
"In various situations, an organization may require the use of a break glass account to gain emergency access. In the event of losing access to administrative functions, an organization may experience a significant loss in its ability to provide support, lose insight into its security posture, and potentially suffer financial losses.",High
